Sr no,Raw,Kanji,Hint,Sentence,Hiragana,Meaning,Page no.,,,Sr no,Raw,Kanji,Hint,Sentence,Hiragana,Meaning,Page no.
282,金遣いが荒い＊,金遣いが荒い,使い方が良くない、乱歩な方,彼は金遣いが荒いため、貯金をすることが難しいです。,かねづかいがあらい,"Spendthrift, careless with money",13,,,282,下る,下る,,,くだる,"to go down, to descend",30
283,予てから,予てから,"予てより (previously, already)",,かねてから,"since some time ago, for quite a while",54,,,283,唇+,唇,,,くちびる,lips,46
284,庇う,庇う,他人から害を受けないように守る,彼は友人を庇うために自分を犠牲にしました。,かばう,To protect or defend,18,,,284,口紅,口紅,,,くちべに,lipstick,46
285,カプセル,カプセル,​From German “Kapsel”,,かぷせる,Capsule,133,,,285,ぐっすり＊＊,ぐっすり,,,ぐっすり,sound asleep,94
286,気触れる＊,気触れる,,,きふれる,"To be touchy, irritable",34,,,286,首になる＊,首になる,,,くびになる,"to be sacked, to be fired",67
287,花粉症,花粉症,,春になると、花粉症の症状が出始めます。,かふんしょう,"Hay fever, pollinosis (allergy to pollen)",23,,,287,汲む,汲む,"酌む- to pour (sake), to serve",,くむ,"to draw (water), to ladle, to scoop up",18
288,構える,構える,,,かまえる,"To prepare, set up",92,,,288,グラス,グラス,,,グラス,glass (for drinking),53
289,噛み切る＊,噛み切る,,,かみきる,to bite off,129,,,289,クリーニング,クリーニング,,,クリーニング,cleaning (laundry or dry cleaning),20
290,過密,過密,,,かみつ,"Overcrowding, congestion",95,,,290,くり返し,くり返し,,,くりかえし,"repetition, doing something over and over",64
291,がみがみ＊＊,がみがみ,煩いこと思うこと,いつも母親にがみがみ言われる。,がみがみ,"nagging, griping",50,,,291,くり返す,くり返す,,,くりかえす,to repeat,64
292,絡む,絡む,困ることを言う、相手に迷惑を掛ける,,からむ,"To get entangled, involved",35,,,292,クリック,クリック,,スタートボタンをクリックする,クリック,click,68
293,仮に,仮に,,,かりに,"Supposing, even if, granting that",59,,,293,苦しい,苦しい,,,くるしい,"Painful, difficult, tough",82
294,カルテ,カルテ,From German “Karte”,,カルテ,"patient's chart, clinical records​, record (e.g. student, equipment maintenance, etc.)",133,,,294,苦しむ,苦しむ,,,くるしむ,"to suffer, to endure",82
295,枯れる,枯れる,"to mature (of one's personality, abilities, etc.)",,かれる,"to wither (of a plant), to die",138,,,295,包む②,包む,,,つつむ,to wrap,15
296,辛うじて,辛うじて,,,かろうじて,"barely, narrowly, only just",58,,,296,暮れ,暮れ,,,くれ,year-end,28
297,交わす,交わす,Aさんと言葉を変える (しっかり話し合う)、交わす (挨拶ぐらい),挨拶を交わす。,かわす,"To exchange (messages, greetings, arguments, etc.)",21,,,297,クレジットカード,クレジットカード,,,クレジットカード,credit card,54
298,代わる代わる,代わる代わる,順番で,代わる代わる使ってください。,かわるがわる,"Alternately, one after another",51,,,298,加える,加える,,,くわえる,"to add, to include",16
299,癌+,癌,,癌の早期発見は治療の成功につながることがあります。,がん,cancer,23,,,299,詳しい,詳しい,,,くわしい,"detailed, full, minute",87
300,かんかん＊＊,かんかん,①かなり、酷く ②日差しが強い,かんかん①に怒る ②照り付ける。,かんかん,Kankan (Guinea),48,,,300,経済学,経済学,,,けいざいがく,economics,62
301,がんがん＊＊,がんがん,頭が激しく痛い、酷く痛い (大きく音がする),,がんがん,"clanging, banging, loudly​",48,,,301,経済学部,経済学部,,,けいざいがくぶ,faculty of economics,62
302,勘違い＊,勘違い,,,かんちがい,"misunderstanding, wrong guess",148,,,302,計算,計算,,,けいさん,calculation,61
303,感に触わる＊,感に触わる,癪に障る＊、気に入らなくて腹が立つ,感情的に怒る上司に感に触わる。,かんにさわる,"To be offended or bothered by something, to take offense",15,,,303,携帯電話,携帯電話,,,けいたいでんわ,mobile phone,33
304,カンパ,カンパ,,,かんぱ,"Contribution, donation",121,,,304,下車,下車,,,げしゃ,"getting off (a train, bus, etc.)",32
305,完ぺき,完ぺき,,,かんぺき,"Perfect, flawless",40,,,305,下旬,下旬,,,げじゅん,latter part of the month,28
306,気合,気合,,,きあい,"Fighting spirit, determination",68,,,306,削る,削る,鉛筆を,,けずる,"to shave, to trim",61
307,気がある＊,気がある,,,きがある,"To be interested, have a liking for",145,,,307,ケチ(な)＊＊,ケチ(な),,,ケチ,"stinginess, shabby, cheap",81
308,気が利く＊,気が利く,①細かいことまで良く気付く ②お洒落な様子、よくできた,①彼女は ②〜たプレゼントがなかなか見つからない気が利く,きがきく,"to be sensible, to be smart",145,,,308,結果,結果,,,けっか,"Result, outcome, effect",65
309,着飾る＊,着飾る,,,きかざる,"To dress up, adorn oneself",130,,,309,結局,結局,,,けっきょく,"after all, in the end",92
310,気が散る＊,気が散る,,,きがちる,"to get distracted, to jump off the track",145,,,310,結構,結構,副詞,,けっこう,"fine, splendid",92
311,気兼ねする＊,気兼ねする,遠慮する、気を使う,気兼ねする～ないでリラックスして。,きがねする,"To feel uneasy, to be cautious, to hesitate",15,,,311,欠席,欠席,,,けっせき,absence (from school or work),60
312,気が向かない＊,気が向かない,,,きがむかない,"Not in the mood, not inclined to",145,,,312,げっぷ＊＊,げっぷ,,,げっぷ,burp,84
313,気管支炎,気管支炎,喉にワイルスが入る,寒い季節になると、気管支炎の症状が悪化しやすくなります。,きかんしえん,Bronchitis,23,,,313,月末,月末,,,げつまつ,end of the month,28
314,帰国,帰国,,,きこく,Return to your country,76,,,314,煙い,煙い,,,けむい,smoky,53
315,気心,気心,,,きごころ,"One's true feelings, disposition",68,,,315,煙たい,煙たい,,,けむたい,"smoky, irritating smoke",53
316,気障(な),気障,人、見につける物、話し方、行動、見せびらかす,,きざ,"Affected, pretentious, snobbish",13,,,316,煙+,煙,,,けむり,smoke,52
317,気さく,気さく,,彼はとても気さくで、新しい友達を作りやすいです。,きさく,"Friendly, open, approachable",12,,,317,険しい,険しい,X 緩やかな坂道、山、(苦しんでいる、厳しい),,けわしい,"steep, difficult",86
318,軋む,軋む,固いものが滑ってする音,,きしむ,"To creak, grate",32,,,318,喧嘩,喧嘩,,,けんか,"fight, argument",44
319,築く,築く,,,きずく,"To build, to construct, to erect",92,,,319,現金,現金,,,げんきん,cash,54
320,気立てがいい＊,気立てがいい,人を思い遣りが良い,彼女は気立てがいいので、周りの人々に常に優しく接します。,きだてがいい,"Good-natured, pleasant disposition",12,,,320,言語学,言語学,,,げんごがく,linguistics,62
321,来る②,来る,,,きたる,"next (e.g. ""next April""), forthcoming",146,,,321,件名,件名,,,けんめい,"subject (of a letter, email, etc.)",70
322,きちっと＊＊,きちっと,,きちっとしてね。,きちっと,"exactly, perfectly",53,,,322,濃い,濃い,,,こい,"dark, strong (e.g., color, flavor)",17
323,几帳面,几帳面,一つ一つのことを丁寧にする、+ve 印象,彼女は几帳面な性格で、計画的に行動します。,きちょうめん,"Methodical, punctual, neat",12,,,323,恋+,恋,,,こい,"love, romantic feelings",44
324,きっかり＊＊,きっかり,,,きっかり,"exactly, just, precisely​",52,,,324,恋人,恋人,,,こいびと,"lover, sweetheart",45
325,きっぱり＊＊,きっぱり,はっきり,きっぱり断る、諦める,きっぱり,"clearly, plainly, distinctly",52,,,325,コインランドリー,コインランドリー,,,コインランドリー,coin laundry,20
326,気長,気長,,,きなが,"Patient, long-suffering",68,,,326,硬貨,硬貨,1円、5円、10円。。。,,こうか,coin,38
327,気に障る＊,気に障る,気分が悪くなる,すぐに人のせいにする態度は気に障る。,きにさわる,"To be offended or bothered by something, to take offense",15,,,327,合格,合格,,,ごうかく,"passing (an exam), success",62
328,気品がある＊,気品がある,上品,彼女の服装と態度は本当に気品がある。,きひんがある,"Elegant, refined, dignified",12,,,328,合格発表,合格発表,,,ごうかくはっぴょう,announcement of exam results,62
329,気紛れ＊,気紛れ,好き嫌いもよく変わる、気分が変りやすい、Meghanaさん、二さん,彼女は気紛れで、その日の気分によって行動が変わります。,きまぐれ,"Fickle, whimsical, capricious",13,,,329,後期,後期,,,こうき,latter half of the year/term,60
330,生真面目(な),生真面目,ルールは絶対、真面目過ぎる、-ve,,きまじめ,"Serious, diligent, earnest",12,,,330,講義,講義,,,こうぎ,lecture,"62, 63"
331,気まずい,気まずい,気分がまずい、合わない,,きまずい,"Awkward, uncomfortable",43,,,331,公共料金,公共料金,,,こうきょうりょうきん,public utilities charge,38
332,決まりが悪い＊,決まりが悪い,他の人に見られない,新しい環境で彼は決まりが悪い感じがすることが多いです。,きまりがわるい,Feeling embarrassed or uncomfortable,14,,,332,合計,合計,,,ごうけい,"Sum total, total amount",61
333,気難しい＊,気難しい,年寄り人,その猫は気難しい性格で、なかなか他の人に懐かない。,きむずかしい,"Difficult, hard to please, finicky",13,,,333,高校生,高校生,,,こうこうせい,high school student,76
334,客観的(な),客観的,,,きゃっかんてき,Objective,95,,,334,口座,口座,,,こうざ,account (e.g. bank),38
335,ギャップ,ギャップ,,,ぎゃっぷ,Gap,123,,,335,交際,交際,≈付き合う,,こうさい,"socializing, companionship",44
336,ギャラ,ギャラ,,,ぎゃら,"Fee, compensation",120,,,336,交差点,交差点,,,こうさてん,"intersection, crossing",36
337,ぎゅっと＊＊,ぎゅっと,Xそっと、強い力で締めったり、押したりする、繋がる,私はあなたをぎゅっと抱きしめたい。,ぎゅっと,"tightly (hold, squeeze, etc.), firmly, forcefully (e.g. push)",53,,,337,工事中,工事中,,,こうじちゅう,under construction,36
338,強行,強行,,,きょうこう,"Enforcement, forcing",77,,,338,高速,高速,,高速道路,こうそく,highway,35
339,行事,行事,,,ぎょうじ,"Event, function",74,,,339,事故,事故,交通,,じこ,accident,37
340,業者,業者,,彼は自営業者として成功しています。 ,ぎょうしゃ,"Merchant, trader",76,,,340,交通費,交通費,,,こうつうひ,traveling expenses,"55, 66"
341,興じる,興じる,,子供たちはサッカーに興じる～ています。,きょうじる,"to amuse oneself, to make merry",93,,,341,後輩,後輩,,,こうはい,"junior (at work, school, etc.), younger people",76
342,矯正,矯正,歯を正しく治療する,子供の歯並びを矯正するために、矯正歯科医を訪れました。,きょうせい,Correction or orthodontics,22,,,342,公立,公立,,,こうりつ,"public (e.g., public school)",60
343,強制的(な),強制的,,,きょうせいてき,"Coercive, compulsory",95,,,343,越える,越える,,,こえる,"to exceed, to cross over",36
344,強烈,強烈,,,きょうれつ,"Intense, powerful",40,,,344,コード,コード,,,コード,"Cord, cable",12
345,極端(な),極端,①一番欲しい ②0 と 100しかない、普通のレベルよりかなり外れている、私の意見、極端な意見,①彼は②彼女は極端①に大人しい。②に大きい服を着ている。,きょくたん,"Extreme, extremity",40,,,345,コーヒーカップ,コーヒーカップ,,,コーヒーカップ,Coffee cup,12
346,煌びやか(な),煌びやか,,煌びやかな宮殿、パーティー、結婚式,きらびやか,"gorgeous, dazzling",37,,,346,氷+,氷,,寒い冬の日には湖の表面が氷で覆われます。,こおり,Ice,12
347,切りがいい＊,切りがいい,,,きりがいい,"Neat, tidy",146,,,347,凍る,凍る,,寒い冬の夜、水が凍る～ます。,こおる,To freeze,12
348,切り替える＊,切り替える,,,きりかえる,"to change, to exchange, to convert",131,,,348,国語,国語,,,こくご,Japanese language,60
349,切りがない＊,切りがない,,,きりがない,"Never-ending, limitless",146,,,349,国内,国内,,,こくない,"domestic, within the country",29
350,義理堅い＊,義理堅い,ちゃんと約束ないで,彼は義理堅い～く、約束を守ることに誇りを持っています。,ぎりがたい,"Obliging, dutiful, loyal to one's obligations",12,,,350,国立,国立,,,こくりつ,national,60
351,限り限り,限り限り,,,ぎりぎり,"Barely, just enough",50,,,351,焦げる,焦げる,,,こげる,"to burn (food), to be scorched",16
352,切れ目＊,切れ目,する,,きれめ,"A break, pause",70,,,352,小さじ,小さじ,,,こさじ,teaspoon,14
353,キレる＊＊,キレる,,,キレる,"to get angry, to lose one's temper",125,,,353,腰+,腰,,,こし,"waist, lower back",82
354,極めて,極めて,,,きわめて,"Extremely, exceedingly",40,,,354,ご主人,ご主人,,,ごしゅじん,(someone else's) husband,78
355,気を配る＊,気を配る,,,きをくばる,"To be attentive, mindful",145,,,355,胡椒,胡椒,,,こしょう,pepper,16
356,緊急,緊急,急いでやらなければならないこと,病院で緊急の輸血が行われました。 ,きんきゅう,"Urgent, emergency",37,,,356,擦る①,擦る,物を他の物に強く押し当てたまま動かすこと,目を手のひらで擦る。,こする,"to rub, to scrub","18, 82"
357,禁じる,禁じる,,,きんじる,"To prohibit, forbid",93,,,357,子育て＊,子育て,,,こそだて,"Child raising, parenting",22
358,勤勉,勤勉,,彼女の勤勉な態度は、仕事で成功するための大きな要因です。,きんべん,"Diligent, industrious",12,,,358,小包,小包,,,こづつみ,"parcel, package",39
359,食い違い＊,食い違い,,,くいちがい,"Discrepancy, disagreement",148,,,359,子ども連れ＊,子ども連れ,,,こどもづれ,with a child,50
360,空間,空間,,,くうかん,"Space, area",73,,,360,断る,断る,,,ことわる,"to refuse, to decline",45
361,潜る②,潜る,何かの下を通り抜けること,鳥居、トンネルを潜る,くぐる,"to pass through, to go through",17,,,361,好み,好み,,,このみ,"liking, preference",48
362,擽ったい,擽ったい,,,くすぐったい,"embarrassing, ticklish",36,,,362,好む,好む,,,このむ,"to like, to prefer",48
363,草臥れる＊,草臥れる,①疲れる ②使いすぎて古くなる,,くたびれる,"To become tired, worn out",30,,,363,零す,零す,,,こぼす,to spill,"18, 52"
364,愚痴,愚痴,,,ぐち,"idle complaint, grumble",149,,,364,零れる,零れる,,ミルクが零れる～ている,こぼれる,"To spill, to fall out of, to overflow","18, 52"
365,口が重い＊,口が重い,,,くちがおもい,incommunicative,143,,,365,凝る,凝る,肩に,,こる,to become stiff (of muscles),84
366,口が肥える＊,口が肥える,,,くちがこえる,To have refined taste,143,,,366,今学期,今学期,,,こんがっき,this semester,60
367,口が滑る＊,口が滑る,,,くちがすべる,"To let something slip, say something unintended",143,,,367,混雑,混雑,,,こんざつ,"congestion, crowding",32
368,口から先に生まれたよう＊,口から先に生まれたよう,,,くちからさきにうまれたよう,"Talks a lot, talks endlessly",147,,,368,コンセント,コンセント,,スマートフォンを充電するためにコンセントを使います。,コンセント,"Electric outlet, socket",12
369,口遊む＊,口遊む,歌を低い声で歌う,,くちずさむ,"To hum, to sing softly, to murmur",16,,,369,混んでいる,混んでいる,,,こんでいる,to be crowded,36
370,ぐちゃぐちゃ＊＊,ぐちゃぐちゃ,ものが混ざっている,もの、服はぐちゃぐちゃする。,ぐちゃぐちゃ,"pulpy, soppy",48,,,370,コンビニ,コンビニ,,,コンビニ,convenience store,66
371,口を挟む＊,口を挟む,,,くちをはさむ,To cut into (a conversation),143,,,371,祭日,祭日,,,さいじつ,public holiday,28
372,覆す,覆す,,,くつがえす,"To overturn, reverse",35,,,372,サイズ,サイズ,,,サイズ,size,48
373,くっきり＊＊,くっきり,X ぼんやり、絵によく使う、はっきり、見えやすい状態,,くっきり,"clearly (standing out), distinctly",52,,,373,サイドミラー,サイドミラー,,,サイドミラー,side mirror,34
374,ぐっしょり＊＊,ぐっしょり,布などが水分をたくさん含んで重たくなった状態を指す,汗でシャツがぐっしょりしている。,ぐっしょり,"soaking (wet), dripping",52,,,374,採用,採用,,,さいよう,"Use, adoption, acceptance",100
375,ぐったり＊＊,ぐったり,,,ぐったり,"exhaustedly, unenergetically",52,,,375,材料,材料,,,ざいりょう,"ingredients, materials",15
376,首が回らない＊,首が回らない,,,くびがまわらない,Unable to turn one's head,144,,,376,サイン,サイン,,,サイン,sign (signature),38
377,首を縦に振る＊,首を縦に振る,Yes,,くびをたてにふる,To nod one's head,144,,,377,探す,探す,,,さがす,"to search, to look for",66
378,首を突っ込む＊,首を突っ込む,,,くびをつっこむ,"To meddle, get involved",144,,,378,下がる,下がる,,,さがる,"to drop, to fall","32, 102"
379,首を長く＊,首を長く,,,くびをながく,"To eagerly await, look forward to",144,,,379,一昨昨日,一昨昨日,,,さきおととい,three days ago,28
380,首を捻る＊,首を捻る,,,くびをひねる,"To ponder, think hard",144,,,380,咲く,咲く,,,さく,to bloom,86
381,首を横に振る＊,首を横に振る,いいえ、ダメだ,,くびをよこにふる,To shake one's head,144,,,381,昨日①,昨日,,,きのう,yesterday,28
382,組み込む＊,組み込む,,,くみこむ,"To incorporate, integrate",128,,,382,削除,削除,,不要なファイルを削除しました。 ,さくじょ,"deletion, elimination, striking out",70
383,雲を掴むよう＊,雲を掴むよう,,,くもをつかむよう,Impossible to grasp,147,,,383,昨年,昨年,,,さくねん,last year,28
384,くよくよ＊＊,くよくよ,いつまでも悩んで気にするようなこと,,くよくよ,"to fret (over), to brood (about)",50,,,384,酒,酒,,,さけ,"alcohol, sake","14, 52"
385,包む②,包む,"くるむ= wrap, つつむ= Cover",赤ちゃんをバスタオルで包む。,くるむ,"To wrap, to envelop, to cover",16,,,385,下げる,下げる,,,さげる,"to lower, to hang down","50, 102"
386,グレードアップ,グレードアップ,,,グレードアップ,"upgrade, update",124,,,386,差出人,差出人,,,さしだしにん,sender,70
387,呉れ呉れも,呉れ呉れも,心を込めて,呉れ呉れも①宜しくお願いします。②お気をつけてください。③お大事にしてください。,くれぐれも,"sincerely, wholeheartedly​",51,,,387,差出人名,差出人名,,,さしだしにんめい,sender's name,39
388,暮れる,暮れる,,夕方になると空が暮れる～ます。,くれる,"To get dark, to grow dark",92,,,388,座席,座席,,,ざせき,seat,30
389,食わず嫌い＊,食わず嫌い,,,くわずぎらい,Disliking something without trying it,148,,,389,誘う,誘う,,,さそう,"to invite, to ask (someone to do something)",44
390,ぐんと＊＊,ぐんと,,,ぐんと,"remarkably, noticeably",61,,,390,札①,札,,,さつ,"banknote, bill, note","38, 54"
391,軽快(な),軽快,快い、軽くて気持ちがいい,リズムが軽快でテンポが速い,けいかい,"light (of movements), light-hearted",36,,,391,ざっと＊＊,ざっと,,,ざっと,"roughly, briefly",95
392,軽率(な),軽率,あまり深く考えずに行動する,軽率な決定は後で後悔することが多いです。,けいそつ,"Rash, thoughtless, careless",13,,,392,さっぱり＊＊,さっぱり,x すっきり,,さっぱり,"feeling refreshed, completely",94
393,汚らわしい,汚らわしい,汚れている、本当に汚いじゃなくてやっている事は汚い、結婚しているのに他の人と関係がある,,けがらわしい,"Filthy, unfair, dirty, untouchable",38,,,393,錆びる,錆びる,～た包丁,,さびる,to rust,86
394,消し去る＊,消し去る,,,けしさる,"To erase, remove completely",130,,,394,サボる＊＊,サボる,,,サボる,"to skip, to play hooky",63
395,決意,決意,,,けつい,"Decision, determination, resolution",94,,,395,様々,様々,な商品,,さまざま,"various, diverse",97
396,結核,結核,,結核は感染性の病気です。,けっかく,Tuberculosis,25,,,396,冷ます,冷ます,,,さます,to cool (something down),16
397,げっそり＊＊,げっそり,急に痩せている、健康じゃ無い,,げっそり,to be disappointed​,52,,,397,冷める,冷める,,,さめる,"to cool down, to become cold",16
398,ゲット,ゲット,,,ゲット,"getting, obtaining, winning",122,,,398,再来月,再来月,,,さらいげつ,month after next,28
399,貶す,貶す,X 褒める,彼は他人を貶すことなく、誰に対しても尊重します。,けなす,To criticize or disparage,18,,,399,再来週,再来週,,,さらいしゅう,week after next,28
400,気配,気配,,,けはい,"Indication, sign, hint",94,,,400,再来年,再来年,,,さらいねん,year after next,28
401,家来,家来,,,けらい,"Follower, retainer",70,,,401,サラダ油,サラダ油,,,さらだゆ,"salad oil, vegetable oil",14
402,下痢,下痢,トイレの大きい方、大きい方のトイレは汚れています,旅行先で下痢にかかったので、医者に診てもらいました。,げり,Diarrhea,22,,,402,サラリーマン,サラリーマン,,,サラリーマン,"salaryman, office worker",76
403,現行,現行,,,げんこう,"Present, current",88,,,403,騒がしい,騒がしい,,,さわがしい,noisy,52
404,建設的(な),建設的,,,けんせつてき,Constructive,95,,,404,騒ぐ,騒ぐ,,,さわぐ,"to make noise, to make racket",52
405,健全(な),健全,,,けんぜん,"Healthy, wholesome",36,,,405,触る,触る,初めてパソコンを,,さわる,"To touch, to feel",68
406,見地,見地,,,けんち,"Perspective, viewpoint",72,,,406,参加,参加,,彼はサッカーの試合に参加しました。,さんか,participation,69
407,現地,現地,,,げんち,"actual place, actual location",88,,,407,算数,算数,,,さんすう,arithmetic,60
408,見当,見当,,,けんとう,"Estimate, guess",84,,,408,三男,三男,,,さんなん,third son,76
409,現に,現に,,,げんに,"Actually, in fact",58,,,409,散歩,散歩,,,さんぽ,"walk, stroll",23
410,現場,現場,事件、事故があった場所,事故現場に呆然とする驚いて声を出さない。,げんば,"actual spot, scene (of a crime, accident, etc.)",88,,,410,仕上がる＊,仕上がる,,終わる (を仕上げる ≈終わらせる) 仕上がる①クリーニングの仕上がりはいつですか。②ケーキの仕上げに苺を載せる,しあがる,"to be finished, to be completed",20
411,見聞,見聞,,,けんぶん,"Experience, knowledge",79,,,411,仕上げる＊,仕上げる,,このプロジェクトを仕上げるのにまだ時間がかかります。,しあげる,"to finish up, to complete",64
412,賢明(な),賢明,,,けんめい,"wise, sensible, well-advised, intelligent",12,,,412,明々後日,明々後日,,,しあさって,the day after tomorrow,28
413,恋+,恋,人、妻、家族を愛する、人が好き、人に恋をする,恋の兆しを感じます。 ,こい,(romantic) love,18,,,413,シートベルト,シートベルト,,,シートベルト,seatbelt,34
414,合意,合意,,,ごうい,"Agreement, consensus",79,,,414,ジーンズ,ジーンズ,,,ジーンズ,jeans,21
415,交互,交互,順番を変わること,,こうご,"Alternate, mutual, reciprocal​",148,,,415,塩からい,塩からい,,,しおからい,salty,17
416,皓々と,皓々と,ピカピカ,①星が皓々と①輝いている。②光って耀いている。,こうこうと,bright (esp. of the moon),48,,,416,仕送り＊,仕送り,,彼は大学での生活費のために仕送りをもらっています。,しおくり,"allowance, remittance",39
417,交際,交際,≈付き合う,,こうさい,"Association, friendship, company (with)",148,,,417,時間割,時間割,,,じかんわり,"timetable, schedule",60
418,公私,公私,,,こうし,Public and private,86,,,418,時給,時給,,,じきゅう,"Hourly pay, hourly wage",66
419,高尚(な),高尚,,高尚な趣味,こうしょう,"high, noble, refined, advanced​",43,,,419,敷く,敷く,,絨毯を床に敷く～て、部屋を暖かくしました。,しく,"To spread, lay down (eg, a carpet)",13
420,口実,口実,,,こうじつ,"Excuse, pretext",86,,,420,時刻,時刻,,,じこく,"Time, (the) hour",30
421,向上,向上,,生産性向上のために、能率を高める必要があります。,こうじょう,"Improvement, advancement",85,,,421,時刻表,時刻表,,,じこくひょう,"timetable, schedule",30
422,行進,行進,,,こうしん,"March, procession",71,,,422,自習,自習,,,じしゅう,self-study,61
