Sr no,Raw,Kanji,Hint,Sentence,Hiragana,Meaning,Page no.,,,Sr no,Raw,Kanji,Hint,Sentence,Hiragana,Meaning,Page no.
1,相子,相子,,,あいこ,"draw, tie​",148,,,1,相手,相手,,,あいて,"Opponent, partner",44
2,合図,合図,,,あいず,"sign, signal",87,,,2,曖昧(な),曖昧,,,あいまい,"unclear, ambiguous",45
3,愛想がいい＊,愛想がいい,/悪い、人に接する時の態度、表情,彼女はいつも愛想がいい人です。,あいそがいい,"Friendly, sociable, pleasant demeanor",12,,,3,アイロン,アイロン,,,アイロン,Iron,20
4,間柄,間柄,,,あいだがら,"Relationship, connection",89,,,4,遭う,遭う,交通事故に,,あう,"To encounter, to meet",37
5,相次ぐ＊,相次ぐ,,,あいつぐ,To happen in succession,92,,,5,アクセル,アクセル,,,アクセル,Accelerator (gas pedal),34
6,生憎,生憎,,,あいにく,"unfortunately, sorry, but ...​",58,,,6,欠伸,欠伸,,,あくび,Yawn,84
7,合間,合間,,,あいま,"interval, break, pause",73,,,7,揚げる,揚げる,,彼女は天ぷらを揚げる～ました。,あげる,"To fry, to deep-fry",16
8,敢えて,敢えて,,,あえて,"Boldly, daringly",58,,,8,憧れる,憧れる,,,あこがれる,"to long for, to yearn after",44
9,仰向け＊,仰向け,,寝るとき、私は通常仰向けに寝ます。,あおむけ,"Face up, lying on one's back",17,,,9,味見,味見,,料理を作る前に味見をすることは大切です。,あじみ,Tasting,17
10,垢+,垢,,,あか,"Grime, dirt",139,,,10,明日,明日,,,あした,Tomorrow,28
11,足掻く＊,足掻く,implies a sense of desperate or violent struggle,水中で足掻く～て泳ぎました。,あがく,"To struggle, to kick, to flail one's legs",17,,,11,預ける,預ける,,この銀行にお金を預ける～ています。,あずける,"To leave (in someone's keeping), to put (in someone's care), to entrust (someone) with",38
12,明かす,明かす,,,あかす,"To reveal, make clear",70,,,12,汗+,汗,,,あせ,"Sweat, perspiration",84
13,赤の他人＊,赤の他人,,,あかのたにん,A total stranger,148,,,13,汗臭い＊,汗臭い,,,あせくさい,Smelly with sweat,84
14,赤らめる,赤らめる,,,あからめる,To blush,30,,,14,与える,与える,,母は子供に愛情をたくさん与える～ます。,あたえる,"To give, to grant",23
15,呆れる,呆れる,Aについて①びっくりする②？,彼に何回注意してもカンニングを止めない。彼に呆れる～てしまう。,あきれる,"to be amazed, to be shocked",15,,,15,温める,温める,,寒い日には手を温めるためにお湯を使います。,あたためる,"To warm, heat up",12
16,悪どい,悪どい,やり方が悪い、1000円のものを一万に売ること,,あくどい,"showy, crooked, vicious",38,,,16,暖める,暖める,,彼は夕食を電子レンジで暖める～ました。,あたためる,"To warm, heat up",13
17,痣+,痣,体を強くぶつけた時にできる、色が紫色になる。,,あざ,Bruise,139,,,17,宛先,宛先,,,あてさき,Destination address,70
18,浅ましい,浅ましい,,彼の浅ましい嘘には誰もが失望しました。,あさましい,"Wretched, shameful, mean",14,,,18,宛名,宛名,,,あてな,Receiver's name,39
19,欺く,欺く,嘘を言って騙す,警察の目が欺く～た。,あざむく,To deceive,18,,,19,アドレス,アドレス,メール,,アドレス,Address,71
20,鮮やか,鮮やか,X ぼんやり、色がはっきりすること、濃い色,,あざやか,"Brilliant, vivid",36,,,20,アドレス帳,アドレス帳,,,アドレス帳,Address book,71
21,嘲笑う＊,嘲笑う,馬鹿にするように笑う、N3? 私はN1 持っています、hahaha,嘲笑うことは他人を傷つける行為です。,あざわらう,To ridicule,18,,,21,穴+,穴,,この壁に小さな穴があります。,あな,Hole,22
22,足が出る＊,足が出る,(予算オーバーになる),一万円〜足が出る,あしがでる,"to exceed the budget, to overrun the budget",145,,,22,アナウンス,アナウンス,,,アナウンス,Announcement,33
23,足が早い＊,足が早い,,,あしがはやい,Fast runner,145,,,23,暴れる,暴れる,,,あばれる,"To act violently, to struggle",52
24,足が棒になる＊,足が棒になる,,,あしがぼうになる,Legs become like sticks (used to describe extreme fatigue),145,,,24,浴びる,浴びる,,,あびる,"To take (e.g. Shower), to bask in (e.g. The sun)",46
25,悪しからず,悪しからず,,,あしからず,Please don't take it the wrong way,146,,,25,油+,油,,揚げ物をする時、油を熱してください。,あぶら,Oil,16
26,足首,足首,,サッカーの試合で足首を怪我しました。,あしくび,Ankle,22,,,26,溢れる,溢れる,,,あふれる,To overflow,52
27,足を引っ張る＊,足を引っ張る,,,あしをひっぱる,"To hold back, hinder someone's progress",145,,,27,雨戸,雨戸,,台風の日には雨戸を閉めます。,あまど,"Storm shutter, wooden outside window blinds",12
28,焦る,焦る,心の中に慌てる、物事を早くやろうと思って落ち着かない,試験前に焦る～ずに、じっくり勉強しましょう。,あせる,"to be in a hurry, to be impatient",15,,,28,甘やかす,甘やかす,,祖父母は孫を甘やかすことがよくあります。,あまやかす,"To pamper, to spoil",22
29,値する,値する,,,あたいする,"To deserve, be worth",93,,,29,網戸,網戸,,夏になると、網戸を使って虫を防ぎます。,あみど,"Screen door, mesh door",12
30,与える,与える,,①賞を ②給料を ③彼は教育に多くの時間を与える～ています。,あたえる,"To give (esp. To someone of lower status), to present, to award",21,,,30,怪しい,怪しい,男,,あやしい,Suspicious,86
31,頭が切れる＊,頭が切れる,,,あたまがきれる,To be sharp-witted,143,,,31,アルバイト,アルバイト,,,アルバイト,Part-time job,66
32,頭が下がる＊,頭が下がる,,,あたまがさがる,"To show respect, deference",143,,,32,ホイル,ホイル,アルミ,,ホイル,Foil,15
33,頭を抱える＊,頭を抱える,,,あたまをかかえる,"To be at a loss, deeply concerned",143,,,33,アレルギー,アレルギー,,,アレルギー,Allergy,82
34,頭を冷やす＊,頭を冷やす,,,あたまをひやす,"To cool down, calm down (emotionally)",143,,,34,泡+,泡,,,あわ,"Bubble, foam",52
35,アダルトサイト,アダルトサイト,,,あだるとさいと,Adult website,124,,,35,暗記,暗記,,,あんき,Memorization,64
36,暑苦しい＊,暑苦しい,,,あつくるしい,"Sultry, oppressive (weather)",36,,,36,暗証番号,暗証番号,,,あんしょうばんごう,PIN (Personal Identification Number),38
37,呆気ない,呆気ない,思ったよりも簡単,,あっけない,"Disappointing, underwhelming",38,,,37,安全(な),安全,,,あんぜん,Safety,87
38,あっさり＊＊,あっさり,①複雑ではない味が濃くない油っぽくない ②時間をかけずに簡単に,あっさり①した味。②罪を認めた。,あっさり,"easily, readily, quickly",52,,,38,胃+,胃,,,い,Stomach,82
39,圧倒的(な),圧倒的,,①バスケットボールはアメリカが ②反対意見を圧倒的①に強い。②に多い。,あっとうてき,overwhelming,40,,,39,いい加減(な)＊＊,いい加減(な),,,いいかげん,"irresponsible, perfunctory, careless",81
40,アットホーム,アットホーム,"Wasei, word made in Japan, From English",,あっとほーむ,"At home, friendly",122,,,40,言い直す＊,言い直す,,,いいなおす,"To correct, to amend",64
41,アトピー,アトピー,"性皮膚炎, Medicine",アトピーの症状が出ることがあります。,アトピー,"Atopy, predisposition toward allergies",23,,,41,医学部,医学部,,,いがくぶ,Medical school,62
42,後回し＊,後回し,,,あとまわし,"Postponement, putting something off",68,,,42,～行き,～行き,ゆき,,～いき,Bound for,30
43,アフターケア,アフターケア,,,あふたーけあ,Aftercare,121,,,43,息+,息,,,いき,Breath,82
44,アフターサービス,アフターサービス,"Wasei, word made in Japan, From English",,あふたーさーびす,After-sales service,121,,,44,行き成り＊,行き成り,泣き出す,,いきなり,"Suddenly, abruptly",92
45,あべこべ,あべこべ,,,あべこべ,"Upside down, reversed",148,,,45,育児,育児,,,いくじ,Child care (baby),22
46,危うい,危うい,危険が近づいていること,,あやうい,"Dangerous, in danger",38,,,46,イコール,イコール,,,イコール,Equal,61
47,操る,操る,,,あやつる,"To operate (e.g. A machine), to handle, to manage",90,,,47,医師,医師,,,いし,A doctor,"82, 83"
48,危ぶむ,危ぶむ,,,あやぶむ,"To fear, to doubt",90,,,48,意地悪,意地悪,,,いじわる,"Mean, malicious",81
49,あやふや(な)＊＊,あやふや,はっきりしない、曖昧は固い表現,あやふやな気持ち、返事,あやふや,"uncertain, indefinite",38,,,49,悪戯,悪戯,,,いたずら,"mischief, prank, trick",23
50,過ち,過ち,,,あやまち,"Fault, error, indiscretion",94,,,50,痛み,痛み,,,いたみ,"Pain, damage, injury",83
51,誤り,誤り,,,あやまり,"Error, mistake, slip",94,,,51,炒める,炒める,,,いためる,To stir-fry,16
52,歩み,歩み,,人生の歩みは誰にも予測できません。,あゆみ,A walk or progress,20,,,52,一度に,一度に,,,いちどに,all at once,93
53,歩む,歩む,①人生を送る ②???,①人生の道を共に ②②優勝を目指して歩む ①ことができて幸せです。②〜おう。,あゆむ,To walk (with efforts) (Dictionary form),20,,,53,一気に,一気に,,,いっきに,"in one go, in one gulp, in one breath",52
54,予め,予め,,予めご連絡ください。,あらかじめ,"beforehand, in advance",54,,,54,一昨日,一昨日,,,いっさくじつ,The day before yesterday,28
55,荒らす,荒らす,,公園でゴミを捨てるのは環境を荒らす行為です。,あらす,"To lay waste, to damage",90,,,55,一昨年,一昨年,,,いっさくねん,The year before last,28
56,改まる,改まる,,,あらたまる,"To be renewed, to change",90,,,56,一遍に,一遍に,,,いっぺんに,"(all) at once, at the same time",93
57,荒っぽい,荒っぽい,人、海,①子供たちは②彼は荒っぽい①遊びが好きです。②～く見えますが、実は優しい性格の人なんです。,あらっぽい,"Wild, violent, rough-mannered, rude",13,,,57,一方通行,一方通行,,,いっぽうつうこう,One-way traffic,36
58,凡ゆる,凡ゆる,考えられる、全て,凡ゆる機会,あらゆる,"all, every",41,,,58,従兄弟,従兄弟,従姉妹,,いとこ,Cousin (male),77
59,あり触れる,あり触れる,平凡な話,,ありふれる,"Common, ordinary",34,,,59,居眠り＊,居眠り,,,いねむり,"Dozing, napping",63
60,アルコール,アルコール,,,あるこーる,Alcohol,122,,,60,違反,違反,,,いはん,Violation,37
61,アルツハイマー,アルツハイマー,"病, disease",アルツハイマーは高齢者に多く見られる認知症です。,アルツハイマー,Alzheimer's,23,,,61,鼾+,鼾,,,いびき,Snoring,84
62,合わす,合わす,声、力を,この服はきれいに合わす～せていますね。,あわす,To match or fit,21,,,62,居間,居間,,家族は居間でゲームを楽しんでいます。,いま,Living room,12
63,合わせる顔がない＊,合わせる顔がない,,,あわせるかおがない,"To be too embarrassed, ashamed to face someone",142,,,63,嫌+,嫌,になる,,いや,"Dislike, unwillingness",44
64,アンケート,アンケート,From French “enquête”,,あんけーと,"Survey, questionnaire",133,,,64,嫌がられる,嫌がられる,,,いやがられる,To be disliked,44
65,案じる,案じる,,,あんじる,"To be concerned, worried",93,,,65,嫌がる,嫌がる,,,いやがる,"To dislike, to be unwilling",44
66,安静,安静,,医者の指示に従って安静にしてください。,あんせい,"Rest, quiet, repose",22,,,66,イヤリング,イヤリング,,,イヤリング,Earring,46
67,案の定＊,案の定,,,あんのじょう,"Just as one thought, as usual, sure enough",58,,,67,苛々,苛々,渋滞で、思い通りにならず、落ち着かない事,,いらいら,"to get irritated, to get annoyed",96
68,言い付ける＊,言い付ける,①命令する ②相手に知られるように、こっそり知らせる=告げ口する,①部長に仕事を ②ドアを壊したのは田中さんだと先生に言い付ける①～られた。②～た。,いいつける,To order or command,18,,,68,入れる,入れる,,,いれる,"To put in, to insert, to install (e.g. Software)",13
69,言い張る＊,言い張る,,,いいはる,"To insist, assert",131,,,69,印鑑,印鑑,判子,,いんかん,"Seal, stamp",38
70,言い訳＊,言い訳,,言い訳などしないで、兎に角勉強しなさい。,いいわけ,excuse,89,,,70,インストール,インストール,,,インストール,Installation,68
71,家出,家出,,,いえで,Running away from home,69,,,71,インターネット,インターネット,,,インターネット,Internet,69
72,生かす,生かす,,,いかす,"To make the most of, utilize",75,,,72,インフルエンザ,インフルエンザ,,,インフルエンザ,"Influenza, flu",83
73,如何なる,如何なる,どんな、どのような,如何なる時,いかなる,"any kind of, every, whatsoever",41,,,73,ウィスキー,ウィスキー,,,ウィスキー,Whiskey,52
74,如何に,如何に,,,いかに,How to do it,139,,,74,ウール,ウール,,,ウール,Wool,21
75,如何にも,如何にも,,,いかにも,"indeed, really, truly","56, 139",,,75,ウエーター,ウエーター,,,ウエーター,Waiter,50
76,イカれる＊＊,イカれる,①ダメになる、壊れる②考え方が変、可笑しい。,①エンジンが②あいつの頭、イカれる①。②～ている！,いかれる,"to become broken, to break down",33,,,76,ウエートレス,ウエートレス,,,ウエートレス,Waitress,50
77,息が切れる＊,息が切れる,,,いきがきれる,To be out of breath,144,,,77,嗽+,嗽,,,うがい,Gargling,83
78,息が詰まる＊,息が詰まる,,,いきがつまる,To have one's breath taken away,144,,,78,受かる,受かる,,,うかる,To pass (an exam),62
79,息が長い＊,息が長い,,,いきがながい,"To have a long life, patience",144,,,79,浮く,浮く,,,うく,To float,86
80,息苦しい＊,息苦しい,息が切れる,息苦しい雰囲気,いきぐるしい,"Suffocating, hard to breathe",36,,,80,受付,受付,,,うけつけ,Reception desk,98
81,意気込む＊,意気込む,ある事を実現しようと強い気持ちを持つ,『合格するぞ！』、『彼女できるぞ！』と意気込む。,いきごむ,"To be enthusiastic, motivated",31,,,81,受け付ける＊,受け付ける,,,うけつける,"To accept, to receive",98
82,行き違い＊,行き違い,,,いきちがい,"Misunderstanding, miscommunication",148,,,82,受け取り＊,受け取り,,,うけとり,"Receipt, receiving",98
83,息の合う＊,息の合う,,,いきのあう,To get along well,144,,,83,受け取る＊,受け取る,,彼から手紙を受け取る～ました。,うけとる,"To receive, to take, to interpret",98
84,息もつかずに,息もつかずに,,,いきもつかずに,Without a moment's rest,144,,,84,受ける,受ける,,,うける,To receive,"50, 62, 83"
85,息を抜く＊,息を抜く,,,いきをぬく,"To take a break, rest",144,,,85,動かす,動かす,,,うごかす,To move (something),35
86,息をのむ＊,息をのむ,,,いきをのむ,To take one's breath away,144,,,86,薄い,薄い,,,うすい,"Thin, light (color)",17
87,息を引きとる＊,息を引きとる,,,いきをひきとる,"To die, pass away",144,,,87,薄暗い＊,薄暗い,,,うすぐらい,"Dim, gloomy",87
88,生ける,生ける,花瓶に花を差す、形良く,①彼女は庭に美しい花々を ②花器に花を生ける①のが得意です。②。,いける,To arrange flowers,20,,,88,嘘+,嘘,,,うそ,"lie, fib, falsehood, untruth",81
89,意向,意向,,,いこう,"Intention, purpose",72,,,89,嘘吐き＊,嘘吐き,,,うそつき,liar,81
90,いざという時＊,いざという時,,,いざというとき,"at the critical moment, when the time comes",54,,,90,内側,内側,,,うちがわ,"Inside, interior",32
91,潔い,潔い,汚れがなく、立派である,潔い～く迷うこと近く決心する,いさぎよい,"Honest, pure, virtuous",12,,,91,うっかり＊＊,うっかり,気つかない,,うっかり,"carelessly, thoughtlessly",94
92,いざ知らず,いざ知らず,,,いざしらず,"Who knows, it's hard to say",146,,,92,唸る,唸る,,,うなる,"to groan, to moan",22
93,いざという時＊,いざという時,,,いざというとき,"at the critical moment, when the time comes, when it's most important",146,,,93,生まれ,生まれ,,,うまれ,Birth,78
94,勇ましい,勇ましい,,彼は困難な状況にも勇ましい顔をして立ち向かいます。,いさましい,"Brave, valiant, courageous",12,,,94,埋める,埋める,穴を,,うめる,to bury (e.g. in the ground),22
95,意志,意志,〜しようと思う気持ち、意志薄弱,,いし,"Will, determination",72,,,95,裏返す＊,裏返す,,,うらがえす,"To turn inside out, to flip",16
96,意思,意思,,日本に留学する意思が固い。,いし,"Thoughts,wish, purpose",72,,,96,羨ましい,羨ましい,,,うらやましい,"Envious, jealous",44
97,意地,意地,,,いじ,"Willpower, determination, stubbornness",72,,,97,売り切れ＊,売り切れ,,,うりきれ,Sold out,49
98,意識,意識,頭で考えること,意識を失った男性を助けました。,いしき,"Consciousness, becoming aware (of)",22,,,98,売り切れる＊,売り切れる,,コンサートのチケットはすぐに売り切れる～ました。,うりきれる,to be sold out,49
99,意識不明,意識不明,"unresponsive or unaware of their surroundings due to various reasons such as injury, illness, or anesthesia",事故の後、彼は意識不明の状態で病院に運ばれました。,いしきふめい,Unconsciousness,22,,,99,うろうろ＊＊,うろうろ,変な男が,,うろうろ,"restlessly, aimlessly",96
100,意地っ張り＊,意地っ張り,,,いじっぱり,Stubborn,72,,,100,上着,上着,,,うわぎ,"Jacket, outerwear",46
101,弄る,弄る,①手で触る。②趣味としてAをする,①髪の毛を ②パソコンを ③庭を ④スマホを弄る。,いじる,"To tinker with, to tamper with, to play with",16,,,101,運賃,運賃,,,うんちん,"Fare, transportation charge",32
102,何ずれにしても＊,何ずれにしても,,,いずれにしても,"anyhow, at all events, in any case",59,,,102,運転席,運転席,,,うんてんせき,Driver's seat,34
103,何ずれにせよ＊,何ずれにせよ,,,いずれにせよ,"at any rate, in any event, either way",59,,,103,運転免許証,運転免許証,,,うんてんめんきょしょう,Driver's license,34
104,何ずれも＊,何ずれも,,,いずれも,"any, all, every, both",59,,,104,エアコン,エアコン,,,エアコン,Air conditioner,"12, 13"
105,至って,至って,,,いたって,"Extremely, exceedingly",56,,,105,英会話講師,英会話講師,,,えいかいわこうし,English conversation instructor,66
106,痛ましい,痛ましい,見て痛みを感じる,災害の被害を見ると、痛ましい気持ちになります。,いたましい,"Pitiful, heart-breaking, touching",14,,,106,栄養,栄養,,,えいよう,"Nutrition, nourishment",14
107,痛み,痛み,,けがをした後、痛みを感じることがよくあります。,いたみ,"Pain, damage, injury",22,,,107,餌+,餌,,,えさ,"(animal) feed, fodder, pet food",23
108,至る所＊,至る所,行く先どこでも,,いたるところ,"everywhere, all over, throughout​",41,,,108,エプロン,エプロン,,,エプロン,Apron,18
109,労る,労る,年上を優しくする、体を大事にする、慰める=悲しい時,彼は友達が悲しいときにいつも労る～てあげます。,いたわる,To show sympathy or care,18,,,109,偉い,偉い,,,えらい,"Great, excellent, admirable, important, famous",22
110,一から十まで＊,一から十まで,,,いちからじゅうまで,"From beginning to end, thoroughly",146,,,110,得る①,得る,,,える,"To get, to earn, to acquire",69
111,一字違い,一字違い,,,いちじちがい,One-character difference,148,,,111,宴会,宴会,,,えんかい,"Banquet, party",52
112,一同,一同,,,いちどう,"All together, everyone",140,,,112,エンジン,エンジン,,,エンジン,Engine,34
113,市場②,市場,,,いちば,"Market, bazaar (outdoor sale)",74,,,113,甥+,甥,,,おい,Nephew,77
114,一面,一面,,一晩中、雪が降り続き、辺り一面が真っ白になった。,いちめん,"One side, all over",140,,,114,追い越す＊,追い越す,,他の車を追い越す前に注意が必要です。,おいこす,"To pass (e.g. Car), to overtake​",36
115,一目,一目,惚れ(好きになる),彼女と出会って、一目で惚れました。 ,ひとめ,At a glance or first glance,140,,,115,横断,横断,,,おうだん,"Crossing, intersection",37
116,一樣,一樣,,,いちよう,"The same, identical",140,,,116,横断歩道,横断歩道,,,おうだんほどう,Pedestrian crossing,36
117,一律(な),一律,,この規則は一律に適用されます。,いちりつ,"uniform, even, across-the-board, equal",140,,,117,往復,往復,,,おうふく,Round trip,31
118,一連,一連,,,いちれん,"In a row, in a series",140,,,118,オークション,オークション,,,オークション,Auction,69
119,一挙,一挙,,,いっきょ,"All at once, in one go",140,,,119,大さじ,大さじ,,,おおさじ,Tablespoon,14
120,一見,一見,,,いっけん,"At first sight, initially",140,,,120,お掛けになる＊,お掛けになる,,,おかけになる,To sit (polite),78
121,一向に〜ない＊,一向に〜ない,一向にに平気だ。①少しも、全く変化しない ②全く問題が無い,①病気が②日本語が一向に〜ない①に回復しない。②上達しない。③暖かくならない。,いっこうに〜ない,"Not at all, never",55,,,121,お菜,お菜,,,おさい,"Vegetables, side dish",14
122,一切〜ない＊,一切〜ない,少しも、全く,私は日本に来てから一切〜ない国のインド料理を食べていない。,いっさい〜ない,"Not at all, nothing at all",55,,,122,金持ち＊,金持ち,お,,かねもち,Rich person,55
123,一瞬,一瞬,,,いっしゅん,"A moment, an instant",140,,,123,お代わり,お代わり,コーヒーの,,おかわり,"Another helping, seconds",50
124,一心,一心,,,いっしん,"Wholeheartedly, with one's whole heart",140,,,124,お気に入り＊,お気に入り,,,おきにいり,Favorite,48
125,一新,一新,,,いっしん,"Complete renewal, overhaul",140,,,125,遅れる,遅れる,,,おくれる,To be late,63
126,一斉,一斉,,,いっせい,"Simultaneous, all at once",140,,,126,化粧,化粧,お,,けしょう,Makeup,46
127,一掃,一掃,,,いっそう,"Complete elimination, sweep",140,,,127,奢り,奢り,,,おごり,"Treat, treating someone",54
128,一帯,一帯,,,いったい,"Whole area, region",140,,,128,奢る,奢る,,,おごる,"To treat someone, to pay for",54
129,一変,一変,,,いっへん,"Complete change, transformation",140,,,129,幼い,幼い,,彼女はまだ幼いです。,おさない,"Very young, childish, immature​",22
130,意図,意図,,,いと,"Intention, purpose",72,,,130,叔父,叔父,お,,おじ,Uncle (father's younger brother),76
131,愛しい,愛しい,人,家族とのひとときはいつも愛しい瞬間です。,いとしい,"Lovely, dear, beloved",12,,,131,お洒落,お洒落,お,,おしゃれ,"Stylish, fashionable",47
132,意的,意的,,,いてき,Intentional,97,,,132,尻+,尻,お,,しり,"Buttocks, bottom",22
133,営む,営む,経営する,①会社を ②彼はレストランを営む②～でいます。,いとなむ,"To run (a business), to operate, to conduct",90,,,133,お勧め,お勧め,お,ウエートレスにお勧めを聞く,おすすめ,"Recommendation, suggested",50
134,今更,今更,①今のなっては、今からではもう遅い ②今、初めて ③ここで,今更、①勉強しても、もう無理だよ。②言うまでもないが、③必要はないが、,いまさら,now (when it is already much too late),54,,,134,お住まい,お住まい,お,,おすまい,Place of residence,78
135,未だに〜ない＊,未だに〜ない,今でもまだ,別れて４年経つが、未だに〜ない元彼女が忘れられない。,いまだに,"still, even now, to this day",54,,,135,恐ろしい,恐ろしい,,,おそろしい,"Terrible, dreadful",86
136,今に,今に,近い将来、いつか,今に困るよ。,いまに,"before long, even now",54,,,136,教わる,教わる,お,,おそわる,"To be taught, to learn",64
137,今にも,今にも,,,いまにも,"at any moment (now), at any minute",54,,,137,互い＃,互い,お,,たがい,"Each other, one another",44
138,嫌々,嫌々,渋々、嫌だと思いながら、仕方がなく,,いやいや,unwillingly,50,,,138,お玉,お玉,,,おたま,Ladle,16
139,嫌がらせ,嫌がらせ,相手が嫌だと思うことを言ったり、やったりする,彼女は同僚からの嫌がらせに苦しんでいます。,いやがらせ,Harassment or bullying,18,,,139,落ち着いている＊,落ち着いている,,,おちついている,"to calm down, to compose oneself",80
140,卑しい,卑しい,お金、食べ物,卑しい行為は他人を傷つけます。,いやしい,"Mean, lowly, base, despicable",13,,,140,落ち着く＊,落ち着く,緊張する,,おちつく,"To calm down, to settle","64, 80"
